{
  "id": "example_hypothesis_not_confirmed",
  "title": "Пример: гипотеза роста не подтвердилась — решение на данных",
  "role_at_time": "Специалист по продукту / контенту",
  "target_role": "Product Manager",
  "company": "Компания (аноним)",
  "product": "Лендинг монетизируемой услуги",
  "year": "2024",
  "framework": "STAR",
  "status": "completed",
  "target_grade_parameters": [
    "Качество и скорость discovery",
    "Аналитика"
  ],
  "business_goal": [
    "Проверить гипотезу роста конверсии без масштабирования слабого оффера"
  ],
  "situation": {
    "context": "Конверсия в целевое действие ~25%; exit-опрос показывал сегмент «не понимаю / не нужно».",
    "baseline": "Целевая гипотеза: +10 п.п. после смены value proposition"
  },
  "task": {
    "goal": "Сформулировать и проверить гипотезу смены позиционирования на лендинге."
  },
  "actions": [
    "Сопоставил качественные и количественные сигналы в одну гипотезу с явным целевым эффектом.",
    "Переработал структуру и оффер под сегмент из опроса.",
    "Согласовал с владельцем продукта и выкатил изменение.",
    "Через месяц сравнил метрики до/после (без A/B) и зафиксировал отсутствие эффекта."
  ],
  "results": {
    "outcome": "Гипотеза не подтверждена; команда не продолжила итерации — сэкономлен фокус на слабом рычаге.",
    "metrics": {
      "conversion": "Без статзначимого изменения",
      "measurement_note": "Ограничение: нет A/B — learning зафиксирован явно"
    },
    "qualitative": [
      "Negative result как валидный продуктовый исход",
      "Процесс: гипотеза → релиз → честный вывод"
    ]
  },
  "learnings": [
    "Заранее договариваться о методе проверки (A/B, сроки, метрики)."
  ],
  "role_framing": {
    "business_problem_headline": "Риск вложить команду в неверный value proposition на лендинге с монетизацией.",
    "problem_tags": ["conversion", "experimentation", "honest_negative_result"],
    "hiring_pattern": "Сигнал → гипотеза → релиз → нет эффекта → stop без прикрашивания.",
    "ownership_note": "Инициатор гипотезы и упаковки; владелец фичи — продакт; метод замера — shared learning.",
    "metric_or_proof": "Базовая конверсия и отсутствие статзначимого сдвига.",
    "repeatable_elsewhere": "Любой лендинг услуги с длинным time-on-page и exit-опросом."
  },
  "stakeholders": ["продакт", "дизайн"],
  "tools_and_methods": ["exit-опрос", "до/после", "JTBD-сегментация"]
}
